{
  "personal_info": {
    "name": "山田 太郎",
    "name_kana": "やまだ たろう",
    "birthdate": "1990-04-01",
    "gender": "男性",
    "postal_code": "150-0041",
    "address": "東京都渋谷区神南1-1-1",
    "address_kana": "とうきょうとしぶやくじんなん",
    "phone": "03-1234-5678",
    "mobile": "090-1234-5678",
    "email": "yamada@example.com"
  },
  "contact_info": {
    "postal_code": "100-0001",
    "address": "東京都千代田区丸の内1-1-1",
    "address_kana": "とうきょうとちよだくまるのうち",
    "phone": "03-9876-5432",
    "mobile": "080-1111-2222"
  },
  "education": [
    {
      "date": "2003-04",
      "type": "入学",
      "school": "東京都立〇〇高等学校"
    },
    {
      "date": "2006-03",
      "type": "卒業",
      "school": "東京都立〇〇高等学校"
    },
    {
      "date": "2006-04",
      "type": "入学",
      "school": "〇〇大学",
      "department": "工学部 情報工学科"
    },
    {
      "date": "2010-03",
      "type": "卒業",
      "school": "〇〇大学",
      "department": "工学部 情報工学科"
    }
  ],
  "work_history": [
    {
      "date": "2010-04",
      "type": "入社",
      "company": "株式会社〇〇"
    },
    {
      "date": "2015-03",
      "type": "退職",
      "company": "株式会社〇〇",
      "note": "一身上の都合により"
    },
    {
      "date": "2015-04",
      "type": "入社",
      "company": "株式会社△△",
      "note": "現在に至る"
    }
  ],
  "qualifications": [
    {
      "date": "2012-10",
      "name": "基本情報技術者試験 合格"
    },
    {
      "date": "2014-06",
      "name": "応用情報技術者試験 合格"
    }
  ],
  "additional_info": {
    "motivation": "貴社の〇〇事業に魅力を感じ、応募いたしました。\nこれまでの経験を活かし、貴社の発展に貢献したいと考えております。",
    "self_pr": "私は5年間のシステム開発経験があります。\n特にバックエンド開発を得意としており、\n大規模システムの設計・実装に携わってきました。",
    "remarks": "勤務地は東京都内を希望します。"
  }
}
